{
  "$schema": "vc:entry-key-registry",
  "_format_version": "1.0.0",
  "_note": "Generated by specdev registry-generate from devspec_toolkit/schema/*.schema.json. Do not hand-edit.",
  "_sentinels": [
    "canonical_proposals",
    "canonical_refs_used",
    "out_of_scope"
  ],
  "registry": {
    "00_charter.json": {
      "arrays": [
        {
          "array_path": ".user_segments",
          "id_field": "segment_id",
          "kind": "segment"
        },
        {
          "array_path": ".success_metrics",
          "id_field": "metric_id",
          "kind": "metric"
        }
      ],
      "step": "00"
    },
    "01_capabilities.json": {
      "arrays": [
        {
          "array_path": ".capabilities",
          "id_field": "capability_id",
          "kind": "capability"
        }
      ],
      "step": "01"
    },
    "02_system_sketch.json": {
      "arrays": [
        {
          "array_path": ".components",
          "id_field": "component_id",
          "kind": "component"
        }
      ],
      "step": "02"
    },
    "03_glossary.json": {
      "arrays": [
        {
          "array_path": ".terms",
          "id_field": "term_id",
          "kind": "term"
        }
      ],
      "step": "03"
    },
    "04_fr_list.json": {
      "arrays": [
        {
          "array_path": ".functional_requirements",
          "id_field": "fr_id",
          "kind": "fr",
          "nested": [
            {
              "array_path": ".acceptance_criteria",
              "id_field": "criterion_id",
              "kind": "criterion"
            }
          ]
        }
      ],
      "step": "04"
    },
    "05_interface_contracts.json": {
      "arrays": [
        {
          "array_path": ".apis",
          "id_field": "api_id",
          "kind": "api"
        }
      ],
      "step": "05"
    },
    "06_invariants.json": {
      "arrays": [
        {
          "array_path": ".rules",
          "id_field": "inv_id",
          "kind": "inv"
        }
      ],
      "step": "06"
    },
    "07_nfrs.json": {
      "arrays": [
        {
          "array_path": ".nfrs",
          "id_field": "nfr_id",
          "kind": "nfr"
        }
      ],
      "step": "07"
    },
    "08_fixtures.json": {
      "arrays": [
        {
          "array_path": ".fixtures",
          "id_field": "fixture_id",
          "kind": "fixture"
        }
      ],
      "step": "08"
    },
    "09_impl_plan.json": {
      "arrays": [
        {
          "array_path": ".milestones",
          "id_field": "milestone_id",
          "kind": "milestone"
        }
      ],
      "step": "09"
    },
    "11_redteam.json": {
      "arrays": [
        {
          "array_path": ".threats",
          "id_field": "threat_id",
          "kind": "threat",
          "nested": [
            {
              "array_path": ".mitigations",
              "id_field": "id",
              "kind": "mitigation"
            }
          ]
        },
        {
          "array_path": ".edge_cases",
          "id_field": "id",
          "kind": "edge-case"
        }
      ],
      "step": "11"
    },
    "12_ci_gates.json": {
      "arrays": [
        {
          "array_path": ".jobs",
          "id_field": "job_id",
          "kind": "job"
        }
      ],
      "step": "12"
    },
    "13_extension_manifest.json": {
      "arrays": [
        {
          "array_path": ".extensions",
          "id_field": "extension_id",
          "kind": "extension"
        }
      ],
      "step": "13"
    },
    "14_roadmap.json": {
      "arrays": [
        {
          "array_path": ".milestones",
          "id_field": "milestone_id",
          "kind": "milestone",
          "nested": [
            {
              "array_path": ".tasks",
              "id_field": "task_id",
              "kind": "task"
            }
          ]
        },
        {
          "array_path": ".dependencies",
          "id_field": "id",
          "kind": "dependency"
        }
      ],
      "step": "14"
    }
  },
  "steps_with_deferred_registration": [
    {
      "rationale": "per-milestone files; deferred per Out-of-scope",
      "step": "16a"
    },
    {
      "rationale": "per-milestone files; deferred per Out-of-scope",
      "step": "16b"
    },
    {
      "rationale": "per-milestone files; deferred per Out-of-scope",
      "step": "16c"
    }
  ],
  "steps_without_entry_arrays": [
    {
      "rationale": "no top-level array properties with id fields",
      "step": "02a"
    },
    {
      "rationale": "no top-level array properties with id fields",
      "step": "10"
    },
    {
      "rationale": "no top-level array properties with id fields",
      "step": "13a"
    },
    {
      "rationale": "no top-level array properties with id fields",
      "step": "15"
    },
    {
      "rationale": "no top-level array properties with id fields",
      "step": "16"
    }
  ]
}
